{"assignment":{"assignment_method":"author-assigned","confidentiality":"public","family_id":"omp-native.responsive-incident-console","partition":"anchor","role":"designer"},"capability_tags":["ui-implementation","visual-design-judgment","interaction-design","responsive-layout","accessibility-reasoning"],"decision":"approved","findings":[],"rationale":"Implementation quality is judged from actual rendered desktop and mobile surfaces, semantic structure, responsive behavior, interaction, accessibility, and visual evidence\u2014the designer role contract.","review_type":"split","reviewed_at":"2026-08-15T18:30:00Z","reviewer":"rolebench/reviewer/role-fit-gate-v1","schema_version":"omp.task-review-evidence/v1","task_id":"omp-native.responsive-incident-console","task_version":"1.0.0"}
