{"checks":{"credentials":"pass","host_paths":"pass","personal_identifiers":"pass","private_repository_content":"pass","session_or_model_content":"pass","synthetic_values_explicit":"pass"},"decision":"approved","findings":[],"remediation":[{"finding":"Public prompt must not leak private test expectations or hidden result vectors.","resolution":"Preserved strict public/private separation with public workspace interface and private expected behavior specification."}],"review_type":"privacy","reviewed_at":"2026-08-15T10:39:25Z","reviewer":"rolebench/reviewer/privacy-gate-v1","schema_version":"omp.task-review-evidence/v1","scope":{"prompt_digest_sha256":"34ed2a20c17889a842facaecc31721042d235bb494527f178cf62b772bbf68d5","public_tree_digest_sha256":"b34e50ce1f976a9adf9b419693794278937915ce2be9f13bf3d0b179c68541b4","verifier_digest_sha256":"42abd00a52c49d17abba2044d7a1cb950d30f6686ed9687663b5def7383a7fc0","verifier_private_tree_digest_sha256":"a36d27ac82469e8b97e9fbb5db1ea7101a809452e1d603e7e19656acf7b7cd5a","workspace_digest_sha256":"48b7b30d22faa92f5868901c8a2488a907d2f0bc5d91583e133302373a0caf26"},"task_id":"terminal-bench.cancel-async-tasks","task_version":"2.1-r6"}
