{"decision":"approved","evidence":[{"expression":"Apache-2.0","kind":"official-license","url":"https://github.com/harbor-framework/terminal-bench/blob/main/LICENSE"},{"expression":"MIT","kind":"repository-license","path":"LICENSE"},{"digest_sha256":"7d7bdc1cbedad549fc1140404bd4dc45e5fd0ea7c4186773687d177ad3a0699a","kind":"dataset-release","reference":"terminal-bench/terminal-bench-2-1@6"}],"findings":[],"license":{"expression":"Apache-2.0 AND MIT","redistribution":"permitted"},"requirements":["Retain Terminal-Bench Apache-2.0 attribution and modified-work notice.","Identify SQLite WAL fixtures and passive harness as RoleBench MIT-licensed modifications."],"review_type":"license","reviewed_at":"2026-08-15T07:35:52Z","reviewer":"rolebench/reviewer/license-gate-v1","schema_version":"omp.task-review-evidence/v1","scope":{"public_tree_digest_sha256":"3dd3312ba1e3b8e8b3fe2dc6368662e2c6fd5d920a569aaef99648feff960188","source_digest_sha256":"bc389cab45468f44a03544cbd082274f0bae4ab28465b1163ad27639eedb0c14","source_task":"terminal-bench/db-wal-recovery","verifier_private_tree_digest_sha256":"236958c34f96d8f10297cfaec57358a88fa232ceb25c6b9276ca90e92f6e632d"},"task_id":"terminal-bench.db-wal-recovery","task_version":"2.1-r6"}
