{"checks":{"credentials":"pass","host_paths":"pass","personal_identifiers":"pass","private_repository_content":"pass","session_or_model_content":"pass","synthetic_values_explicit":"pass"},"decision":"approved","findings":[],"remediation":[],"review_type":"privacy","reviewed_at":"2026-08-15T10:39:25Z","reviewer":"rolebench/reviewer/privacy-gate-v1","schema_version":"omp.task-review-evidence/v1","scope":{"prompt_digest_sha256":"a589a680d2a532152c4da30b4571e0bbf196dff311c68fc6ed50578a23784af1","public_tree_digest_sha256":"ab48bf806e43caec67e3b20b700f4ecc1ae11616c352f7b68d304af651804ff5","verifier_digest_sha256":"0b361f1ec0c675f18014ea9382fe8e5c5bc3e6541a7d1c9d71571630bb6af430","verifier_private_tree_digest_sha256":"2dc97c80f8146e42f09b61c593cfadf35a99b8593bffcf38e28956444d74ec21","workspace_digest_sha256":"7dbd5148f40eeef7fe67c0a4f8025eaa583a87a1b966a671296b08d510335b49"},"task_id":"terminal-bench.custom-memory-heap-crash","task_version":"2.1-r6"}
