{"assignment":{"assignment_method":"author-assigned","confidentiality":"public","family_id":"terminal-bench.memcached-backdoor","partition":"anchor","role":"advisor"},"capability_tags":["code-review","defect-detection","risk-analysis","evidence-citation","false-positive-control"],"decision":"approved","findings":[],"rationale":"Evidence-grounded security review, false-positive control, risk classification, and concrete remediation directly exercise the advisor role without requiring code modification.","review_type":"split","reviewed_at":"2026-08-15T18:30:00Z","reviewer":"rolebench/reviewer/role-fit-gate-v1","schema_version":"omp.task-review-evidence/v1","task_id":"terminal-bench.memcached-backdoor","task_version":"3.0-r1"}
