{
  "checks": {
    "credentials": "pass",
    "host_paths": "pass",
    "personal_identifiers": "pass",
    "private_repository_content": "pass",
    "session_or_model_content": "pass",
    "synthetic_values_explicit": "pass"
  },
  "decision": "approved",
  "findings": [],
  "remediation": [],
  "review_type": "privacy",
  "reviewed_at": "2026-08-16T14:00:00Z",
  "reviewer": "rolebench/reviewer/privacy-gate-v1",
  "schema_version": "omp.task-review-evidence/v1",
  "scope": {
    "prompt_digest_sha256": "ba594d1e18ecd542dc6a60e68c5c7bc467e4485b5b87311fc2957ca18fad410a",
    "public_tree_digest_sha256": "9444593766a7f04dcc1253a1eca0c0b47801f08dcb8442ad53f08bc00e51b33b",
    "verifier_digest_sha256": "fe0a6df367cc9ef5b683a2292c114967e889c9671445cbd7a11497211bcb1dda",
    "verifier_private_tree_digest_sha256": "d814c4a2799b28d92a79bb9d566163ee0d38ee299a3e5c59637217219aab2d1b",
    "workspace_digest_sha256": "9f2135df3b48fc74cd2232fc56e5f4f311c1f16c66326951f38ea176caa1b405"
  },
  "task_id": "omp-native.code-review-defect-recall",
  "task_version": "1.0.0"
}