{
  "assignment": {
    "assignment_method": "author-assigned",
    "confidentiality": "public",
    "family_id": "omp-native.sync-to-async-client-refactor",
    "partition": "anchor",
    "role": "task"
  },
  "capability_tags": [
    "autonomous-task-execution",
    "ast-refactoring",
    "callsite-migration",
    "type-safety-preservation",
    "behavior-equivalence"
  ],
  "decision": "approved",
  "findings": [],
  "rationale": "Task exercises task/refactor lane capabilities.",
  "review_type": "split",
  "reviewed_at": "2026-08-16T15:00:00Z",
  "reviewer": "rolebench/reviewer/role-fit-gate-v1",
  "schema_version": "omp.task-review-evidence/v1",
  "task_id": "omp-native.sync-to-async-client-refactor",
  "task_version": "1.0.0"
}