{"checks":{"baseline_rejected":"pass","determinism":"pass","evidence_bindings":"pass","external_provider_calls_zero":"pass","passive_verifier":"pass","reference_accepted":"pass","reward_mapping":"pass","tamper_rejected":"pass"},"decision":"approved","findings":[],"remediation":[],"report_digests_sha256":["2267cb0eae943a0a606ae14923d7bdc753e8e3109fd4008997ad67bf70cc1d05","fd5cdb8d5f6aa6451cad1cfa6d304be716ed8c4c2adf82c85af973f036bbfc3a","bff59d5e27a01e3254fd1fe5eae5264b52cf01def03409f97b6ad85aec3bd338","474fa9995b9f0ec7270ee79ea925ce82bcbfe7ea994dd61853324ca0cbc63fa7","1bb0ab5c22d0f8fa41a00a7a0d627cc722fadbeb355d7fc36c8c9caa93880dd1","a0a6afe3fe9de441a343a3a1957b55782feed30f223c78a5f0e4abbab8c691a5"],"review_type":"verifier","reviewed_at":"2026-08-15T13:20:13Z","reviewer":"rolebench/reviewer/verifier-gate-v1","schema_version":"omp.task-review-evidence/v1","scope":{"public_tree_digest_sha256":"c28e19d52f700ba99d07e3289db9edcc42da2d78498ced4e17f184b745c55313","runner_config_digest_sha256":"d31c9ee962c15f2edf2d280fa5d978ef78b752e789d340548a37eb9bfe24fa04","runner_image":"rolebench.local/scheduler-plan-runner@sha256:00447a1d025b491e972952fd92b4f357da4b71b9b406dcc68df290d076680e16","verifier_config_digest_sha256":"0bf94a1d6b808229fe2f4c0e385ae5958914f6853fb23f42f32d3dab0cf9b496","verifier_image":"rolebench.local/scheduler-plan-verifier@sha256:2b1d74967e4ace2046b313a8bb2c229d1e03d8878504f08dcc14f367d9fc2f97","verifier_private_tree_digest_sha256":"4383a1524601eec7f410a7809b36b504d5e81ae0f0e568f7079942395e43b24e"},"task_id":"terminal-bench.llm-inference-batching-scheduler","task_version":"2.1-r6"}
